id,product,price,category,description
1,Widget Pro,2500,electronics,High-performance widget with advanced sensor array and bluetooth connectivity
2,Mega Bolt,150,hardware,Industrial-grade bolt set with corrosion-resistant titanium coating
3,DataVault,8900,software,Enterprise data management platform with real-time analytics dashboard
4,EcoFilter,320,environmental,Water purification filter using activated carbon and UV sterilization
5,SmartLock,1200,security,Biometric door lock with fingerprint and facial recognition capabilities
